{
    "$schema": "https://json-schema.org/draft-04/schema#",
    "type": "object",
    "properties": {
        "@targetNamespace": {"type": "string"},
        "@elementFormDefault": {"type": "string"},
        "@attributeFormDefault": {"type": "string"},
        "annotation": {"$ref": "#/definitions/annotation_type"}
    },
    "definitions": {
        "annotation_type": {
            "type": "object",
            "properties": {
                "documentation": {"type": "string"}
            }
        }
    }
}