{
    "@targetNamespace": "http://data.europa.eu/europass/model/credentials/w3c#",
    "@elementFormDefault": "qualified",
    "@attributeFormDefault": "unqualified",
    "annotation": {"documentation": "The W3C Verifiable Credential Recommendation does not provide an XML Schema for describing Verifiable Credentials."}
}